{
  "schema": "adventures.visual_sidecar.adjacent.v1",
  "project": "Adventures of Patch",
  "character": "Tournament Trial Environment",
  "sidecar_purpose": "Adjacent sidecar for a tournament trial environment source image; records approved semantics, observed visual facts, and usage constraints.",
  "source_truth_note": "The PNG pixel content is the source of truth; this sidecar is a mechanical and semantic descriptor only.",
  "runtime_use_note": "May be used for environment continuity, prompt-board reference, and slide planning; do not use as a generation seed without provenance approval.",
  "do_not_infer_note": "Do not infer character actions, scores, or off-screen narrative; do not generate new imagery from this sidecar alone.",
  "image": {
    "repo_image_path": "build/adventures/Tournament/tournament-trial-environments/source_images/c4_r3_alt_podium_judging__v1.png",
    "relative_image_path": "c4_r3_alt_podium_judging__v1.png",
    "repo_sidecar_path": "build/adventures/Tournament/tournament-trial-environments/source_images/c4_r3_alt_podium_judging__v1-sidecar.json",
    "relative_sidecar_path": "c4_r3_alt_podium_judging__v1-sidecar.json",
    "image_filename": "c4_r3_alt_podium_judging__v1.png",
    "sha256": "3c119ab0a773a44240c3974dbce201653c4540204cda841078eaeb9d90b6eef5",
    "byte_size": 2421252,
    "mime_type": "image/png",
    "dimensions": {
      "width": 1448,
      "height": 1086
    },
    "mode": "RGB",
    "asset_role": "source-image",
    "acceptance_state": "approved",
    "inspection_mode": "pixel_inspection",
    "confidence": "high",
    "provenance": {
      "generator": "unknown",
      "model": "unknown",
      "generated_at": null,
      "prompt_language": null,
      "prompt": null,
      "prompt_retained": false,
      "prompt_unretained_note": "Provenance has not been determined for this image."
    }
  },
  "summary": "Ceremonial podium and judging view of Trial 4, showing a stage, podium blocks, a blue-and-gold table, banners, an arch, tents, flower beds, and a spacious official presentation area.",
  "observed_visual_facts": {
    "course": [
      "Trial 4 - Long Course / Ceremony"
    ],
    "setting": [
      "Sunny tournament presentation area"
    ],
    "elements": [
      "Stage and podium blocks",
      "Blue-and-gold judging table",
      "Banners and arch",
      "Tournament tents",
      "Flower beds",
      "Spacious official presentation area"
    ],
    "mood": [
      "Ceremonial",
      "Official",
      "Cheerful"
    ]
  },
  "positive_constraints": [
    "Stage, podium blocks, and judging table",
    "Blue-and-gold tournament branding",
    "Banners, arch, and flower beds",
    "Spacious official presentation area"
  ],
  "negative_constraints": [
    "No modern stadium stage",
    "No corporate or sponsor branding"
  ],
  "sidecar_usage": {
    "best_for": [
      "Environment continuity reference",
      "Slide or deck background",
      "Prompt-board source material",
      "Tournament location establishing shot"
    ],
    "not_sufficient_for": [
      "Character-specific scene generation",
      "Narrative action sequencing",
      "Final publication crop without review",
      "Provenance-unaware re-generation"
    ],
    "linear_view_route": null
  }
}
