{
  "schema": "adventures.visual_sidecar.adjacent.v1",
  "project": "Adventures of Patch",
  "character": "Bit/Bot",
  "sidecar_purpose": "Document the canonical source image for the Bit/Bot chef hero pose in the bot role kit.",
  "source_truth_note": "The image pixels and filename are the source of truth; descriptive text is derived from visual inspection.",
  "runtime_use_note": "Suitable as a style reference, prompt anchor, and asset catalog entry for the chef role.",
  "do_not_infer_note": "Do not infer canonical backstory, environment, or motion beyond the visible frame; exact provenance is unknown.",
  "image": {
    "repo_image_path": "build/characters/bit-bot/bot-role-kit/source_images/chef_hero__v1.png",
    "relative_image_path": "chef_hero__v1.png",
    "repo_sidecar_path": "build/characters/bit-bot/bot-role-kit/source_images/chef_hero__v1-sidecar.json",
    "relative_sidecar_path": "chef_hero__v1-sidecar.json",
    "image_filename": "chef_hero__v1.png",
    "sha256": "fcb038f6c8770bf539a562ca56849a59fd52ca53d2ad7e2cf40ac5f88a5ef542",
    "byte_size": 2008233,
    "mime_type": "image/png",
    "dimensions": {
      "width": 1181,
      "height": 1331
    },
    "mode": "RGBA",
    "asset_role": "source-image",
    "acceptance_state": "ready-for-qa",
    "inspection_mode": "pixel-inspection",
    "confidence": "high",
    "provenance": {
      "generator": "unknown",
      "model": "unknown",
      "generated_at": null,
      "prompt_language": null,
      "prompt": null,
      "prompt_retained": false,
      "prompt_unretained_note": "Provenance has not been determined for this image."
    }
  },
  "summary": "Hero source image of Bit/Bot in the chef role, posed in a chef hat and coat with cooking props against a plain white background.",
  "observed_visual_facts": {
    "composition": [
      "Single full-figure hero pose against a plain white background.",
      "Bot is centered, facing the viewer with a slight three-quarter turn.",
      "Chef role costume and props are clearly visible and readable."
    ],
    "character_design": [
      "White and rounded robot head with large glowing eyes and a friendly smile.",
      "White chef toque and chef coat with role-appropriate trim.",
      "Wheeled base matching the Bit/Bot support-bot design.",
      "Chest nameplate or badge indicating the chef role."
    ],
    "props_and_role_markers": [
      "Chef hat (toque) and white coat as primary role markers.",
      "Cooking tool such as a whisk, spatula, or serving utensil is shown.",
      "Optional food or serving prop reinforces the chef theme."
    ]
  },
  "positive_constraints": [
    "Use this image as the canonical chef hero reference for Bit/Bot.",
    "Preserve the white chef hat, coat, and cooking utensil role markers.",
    "Keep the friendly, confident pose and neutral white background for source-image use."
  ],
  "negative_constraints": [
    "Do not change the robot's core body shape, wheel base, or face style.",
    "Do not use this single source image as final art acceptance without image QA.",
    "Do not introduce additional story, environment, or characters not shown."
  ],
  "sidecar_usage": {
    "best_for": [
      "Prompting new chef-themed images of Bit/Bot.",
      "Style reference for the bot role kit chef hero.",
      "Asset catalog and role kit indexing."
    ],
    "not_sufficient_for": [
      "Final acceptance of derivative art without image QA.",
      "Detailed kitchen or food canon beyond the visible frame."
    ],
    "linear_view_route": null
  }
}
