{
  "schema": "adventures.visual_sidecar.adjacent.v1",
  "project": "Adventures of Patch",
  "character": "Patch",
  "sidecar_purpose": "Adjacent metadata sidecar for the canonical hero source image of Patch in the detective role kit, recording observed pixel facts and intended usage.",
  "source_truth_note": "The PNG file is the source of truth for visual content; this sidecar mirrors its exact dimensions, byte size, SHA-256, and mode.",
  "runtime_use_note": "Approved for use as a canonical reference image for Patch's detective role hero render in presentation packages and downstream asset generation.",
  "do_not_infer_note": "Do not infer missing pixels, pose variations, alternate costumes, or provenance beyond what is recorded here; only use the actual image area and metadata.",
  "image": {
    "repo_image_path": "build/canon/patch/role-kits/detective-role-kit/source_images/hero_patch_detective__v1.png",
    "relative_image_path": "hero_patch_detective__v1.png",
    "repo_sidecar_path": "build/canon/patch/role-kits/detective-role-kit/source_images/hero_patch_detective__v1-sidecar.json",
    "relative_sidecar_path": "hero_patch_detective__v1-sidecar.json",
    "image_filename": "hero_patch_detective__v1.png",
    "sha256": "15511c89b88946519c4be73a33a03c2206a62842877725254b58f1e6ffd6120c",
    "byte_size": 1903937,
    "mime_type": "image/png",
    "dimensions": {
      "width": 1086,
      "height": 1448
    },
    "mode": "RGBA",
    "asset_role": "source-image",
    "acceptance_state": "approved",
    "inspection_mode": "pixel_inspection",
    "confidence": "high",
    "provenance": {
      "generator": "unknown",
      "model": "unknown",
      "generated_at": null,
      "prompt_language": null,
      "prompt": null,
      "prompt_retained": false,
      "prompt_unretained_note": "Provenance has not been determined for this image."
    }
  },
  "summary": "Canonical hero source image of Patch in the detective role kit, captured at 1086x1448 in RGBA PNG format.",
  "observed_visual_facts": {
    "format": [
      "PNG"
    ],
    "color_mode": [
      "RGBA"
    ],
    "dimensions": [
      "width: 1086 pixels",
      "height: 1448 pixels"
    ],
    "bit_depth": [
      "8 bits per channel"
    ],
    "transparency": [
      "alpha channel present",
      "alpha values are uniformly 255 (fully opaque)"
    ],
    "metadata": [
      "no PNG text chunks",
      "no embedded sRGB/gAMA/cHRM/iCCP chunks"
    ]
  },
  "positive_constraints": [
    "Use only as the canonical detective role kit hero source image.",
    "Preserve Patch's core identity elements whenever visible in the hero frame: teal hoodie, hood antennae, off-white face panel, black oval eyes with white shine highlights, and teal crossbody bag with > mark.",
    "Layer detective role accessories over Patch's core look without replacing the hoodie, antennae, or core silhouette.",
    "Honor the exact RGBA pixel data and 1086x1448 dimensions.",
    "Adhere to the recorded SHA-256 and byte size for cache and reproduction."
  ],
  "negative_constraints": [
    "Do not use as a final runtime sprite without downscaling or format conversion.",
    "Do not replace the teal hoodie with a full detective coat that obscures Patch's core identity.",
    "Do not remove visible core identity elements such as the teal hoodie, antennae, face panel, or crossbody bag.",
    "Do not infer missing pose variations, alternate costumes, or environment details beyond the visible frame.",
    "Do not remix into non-detective role kits without explicit style-guide review."
  ],
  "sidecar_usage": {
    "best_for": [
      "Canonical reference for detective role kit hero view.",
      "Style consistency checks across detective kit renders.",
      "Prompt anchor for new Patch detective hero images.",
      "Presentation covers and marketing hero panels."
    ],
    "not_sufficient_for": [
      "Animation frame sequences.",
      "Real-time game sprites at target resolutions.",
      "Texture maps for 3D models.",
      "Canonical backstory or environment details beyond the visible frame."
    ],
    "linear_view_route": null
  }
}
