{
  "schema": "adventures.visual_sidecar.adjacent.v1",
  "project": "Adventures of Patch",
  "character": "Software Architect",
  "sidecar_purpose": "Repo-resident semantic image sidecar for the Software Architect prop sheet in the data-architect-product-trio stakeholder pack. Supports prop selection, visual continuity, prompt constraint extraction, and QA for Issue #56 architecture and systems imagery.",
  "source_truth_note": "This sidecar is derived visual evidence for the referenced image. The repo image bytes and package manifest remain authoritative for custody; this sidecar does not authorize derivative images or broaden canon.",
  "runtime_use_note": "Use this sidecar for ordinary textual selection, continuity, and prompt planning. Inspect the image pixels directly when exact composition, small text, physical relationships, or fine visual details matter.",
  "do_not_infer_note": "Do not infer unseen alternate views, additional props, story state, or acceptance of derivative images beyond what is described here.",
  "image": {
    "repo_image_path": "build/characters/stakeholders/data-architect-product-trio/source_images/software_architect_props__v1.png",
    "relative_image_path": "software_architect_props__v1.png",
    "repo_sidecar_path": "build/characters/stakeholders/data-architect-product-trio/source_images/software_architect_props__v1-sidecar.json",
    "relative_sidecar_path": "software_architect_props__v1-sidecar.json",
    "image_filename": "software_architect_props__v1.png",
    "sha256": "e76bbfe2dc0a3babadcbe64969461cad06ec834f4e5f91f44d86b08e2ee5815d",
    "byte_size": 2084592,
    "mime_type": "image/png",
    "dimensions": {
      "width": 1448,
      "height": 1086
    },
    "mode": "RGBA",
    "asset_role": "source_props_image",
    "acceptance_state": "accepted_source_asset",
    "inspection_mode": "pixel_inspected",
    "confidence": "high",
    "provenance": {
      "generator": "ChatGPT / OpenAI image generation",
      "model": "gpt-image-2",
      "generated_at": null,
      "prompt_language": "en",
      "prompt": null,
      "prompt_retained": false,
      "prompt_unretained_note": "Generated by ChatGPT using the OpenAI image gen tool at generation time; the exact prompt was not preserved."
    }
  },
  "summary": "Source prop sheet for the Software Architect stakeholder in the data-architect-product-trio pack. The sheet arranges architecture-themed tools on a plain white background: a tablet or clipboard with a system diagram, a central cube/module, connected boxes, cloud and database icons, dependency arrows, green data blocks, a rolled blueprint, a dark stylus, and a blue hexagon lanyard badge. The style matches the Issue #56 stakeholder prop language: clean vector-adjacent painterly rendering, isolated readable objects, olive-brown and blue accents, and a calm, technically grounded mood.",
  "observed_visual_facts": {
    "composition": [
      "Role-specific prop sheet on a clean white or very light background.",
      "The tablet or clipboard is the largest item and anchors the layout.",
      "Supporting papers, cards, a lanyard badge, a notebook or sticky notes, a pen, charts, diagrams, and role tools are arranged around the tablet.",
      "Each object is isolated, readable, and consistent with the stakeholder colour palette."
    ],
    "props": [
      "Tablet or clipboard showing a system architecture diagram.",
      "Central cube or module symbol with connected boxes or nodes.",
      "Cloud icon and database cylinder icon.",
      "Arrows indicating dependencies or data flow.",
      "Rolled blueprint held or placed beside the tablet.",
      "Dark stylus or technical pen.",
      "Blue lanyard and badge with a hexagonal system/module mark."
    ],
    "style_and_colour": [
      "Clean Adventures editorial / vector-adjacent painterly style.",
      "Rounded readable linework and simplified forms.",
      "Olive-brown, navy, cream, and blue diagram accents.",
      "Soft painterly shading and warm lighting.",
      "No real brand logos, realistic UI detail, or tiny pseudo-text."
    ]
  },
  "positive_constraints": [
    "Treat this image as the Software Architect prop source for Issue #56 stakeholder assets.",
    "Arrange the tablet/clipboard as the largest prop, with supporting architecture tools around it.",
    "Use the Software Architect palette: olive-brown, navy, cream, blue diagram accents.",
    "Keep props simplified but unmistakably architecture-themed: system diagram, module cube, cloud, database, arrows, blueprint, stylus, hexagon badge.",
    "Maintain the clean white background and isolated, reusable source-asset presentation.",
    "Preserve the calm, approachable, technically grounded mood."
  ],
  "negative_constraints": [
    "Do not add generic office clutter or unrelated role props.",
    "Do not overload diagrams with tiny pseudo-text or realistic software UI.",
    "Do not remove the lanyard/badge cue or replace it with a different role's badge icon.",
    "Do not turn the prop sheet into a full scene, environment, or group composition.",
    "Do not introduce other stakeholder colour palettes (purple/gold for data analyst, light blue/green/orange for product manager) as dominant accents."
  ],
  "sidecar_usage": {
    "best_for": [
      "Software Architect prop selection and layout reference.",
      "Prompting architecture and system diagram props.",
      "Continuity checks across stakeholder prop sheets.",
      "QA that the props read as software-architecture rather than generic office supplies."
    ],
    "not_sufficient_for": [
      "Full Software Architect character turnaround (use the hero and alternate source images).",
      "Authorizing derivative images without direct image QA.",
      "Exact OCR of any small diagram or card text."
    ],
    "linear_view_route": null
  }
}
