{
  "schema": "adventures.visual_sidecar.adjacent.v1",
  "project": "Adventures of Patch",
  "character": "Tournament Trial Environments",
  "sidecar_purpose": "Adjacent sidecar for the compiled tournament trial environment asset sheet; provides approved semantics and metadata for the deterministic 4-column by 3-row panel compile.",
  "source_truth_note": "The PNG pixel content is the source of truth; this sidecar describes the compiled sheet layout and does not replace the individual source images.",
  "runtime_use_note": "Use for layout verification, asset planning, and column/row source mapping; do not extract panels as high-resolution sources.",
  "do_not_infer_note": "Do not infer panel contents beyond the visible compile; do not treat the sheet as a generation source.",
  "image": {
    "repo_image_path": "build/adventures/Tournament/tournament-trial-environments/compiled_asset_sheets/sheet__v1.png",
    "relative_image_path": "sheet__v1.png",
    "repo_sidecar_path": "build/adventures/Tournament/tournament-trial-environments/compiled_asset_sheets/sheet__v1-sidecar.json",
    "relative_sidecar_path": "sheet__v1-sidecar.json",
    "image_filename": "sheet__v1.png",
    "sha256": "1448992cf12e187bc4c27d15c7f176e0c9a9168970d833894cbbf33f5d9c0f27",
    "byte_size": 1619556,
    "mime_type": "image/png",
    "dimensions": {
      "width": 1536,
      "height": 1008
    },
    "mode": "RGB",
    "asset_role": "compiled_asset_sheet",
    "acceptance_state": "approved",
    "inspection_mode": "pixel_inspection",
    "confidence": "high",
    "provenance": {
      "generator": "unknown",
      "model": "unknown",
      "generated_at": null,
      "prompt_language": null,
      "prompt": null,
      "prompt_retained": false,
      "prompt_unretained_note": "Provenance has not been determined for this image."
    }
  },
  "summary": "Compiled 4-column by 3-row tournament trial environment asset sheet, deterministic compile of the accepted issue #47 panels for the Tournament Trial Environments.",
  "observed_visual_facts": {
    "layout": [
      "4 columns by 3 rows",
      "Columns represent Trials 1-4",
      "Rows represent hero, alternate/detail, and alternate/map or secondary plates"
    ],
    "columns": [
      "Column 1: Trial 1 - Seven-Day Sprint / Reasonable Defaults Track",
      "Column 2: Trial 2 - Industry Standard High Jump",
      "Column 3: Trial 3 - Hedge Maze / Prize Map",
      "Column 4: Trial 4 - Long Course / False Lines / Ceremony"
    ],
    "style": [
      "Sunny countryside tournament style",
      "Deep blue and gold event branding",
      "Clean editorial vector-adjacent forms"
    ]
  },
  "positive_constraints": [
    "Preserve 4-column by 3-row layout",
    "Maintain the column order for Trials 1-4",
    "Use only as compiled reference, not as high-resolution source"
  ],
  "negative_constraints": [
    "Do not reorder or relabel columns without manifest review",
    "Do not extract individual panels at full source quality"
  ],
  "sidecar_usage": {
    "best_for": [
      "Compiled layout verification",
      "Asset planning and continuity checks",
      "Reference for column and row source mapping"
    ],
    "not_sufficient_for": [
      "High-resolution source extraction",
      "Runtime prompt source without provenance review",
      "Per-panel detail inspection"
    ],
    "linear_view_route": null
  }
}
