{
  "schema": "adventures.visual_sidecar.adjacent.v1",
  "project": "Adventures of Patch",
  "character": null,
  "sidecar_purpose": "Repo-resident sidecar for the Identity Emporium environment asset class overview. Supports environment planning, prompt extraction, and QA across the Identity Emporium asset family.",
  "source_truth_note": "This sidecar is derived visual evidence for the referenced image. The repo image bytes and package manifest remain authoritative for custody; this sidecar does not authorize derivative images or broaden canon.",
  "runtime_use_note": "Use this sidecar for environment selection, prompt planning, and QA. Inspect the image pixels directly for exact signage text, colour values, and small prop details.",
  "do_not_infer_note": "Do not infer unseen rooms, additional locations, or final canon status beyond the observed views and support panels.",
  "image": {
    "repo_image_path": "build/environments/identity-emporium/reference_sheets/overview__v1.png",
    "relative_image_path": "overview__v1.png",
    "repo_sidecar_path": "build/environments/identity-emporium/reference_sheets/overview__v1-sidecar.json",
    "relative_sidecar_path": "overview__v1-sidecar.json",
    "image_filename": "overview__v1.png",
    "sha256": "611f800d276e361f8eacf2129c382c2228794a2e6a8a3c554ece8c54dd6ad2cc",
    "byte_size": 2707860,
    "mime_type": "image/png",
    "dimensions": {
      "width": 1491,
      "height": 1055
    },
    "mode": "RGB",
    "asset_role": "environment_reference_sheet",
    "acceptance_state": "accepted_source_reference",
    "inspection_mode": "pixel_inspected",
    "confidence": "high",
    "provenance": {
      "generator": "unknown",
      "model": "unknown",
      "generated_at": null,
      "prompt_language": null,
      "prompt": null,
      "prompt_retained": false,
      "prompt_unretained_note": "Provenance has not been determined for this image."
    }
  },
  "summary": "Environment class overview for the Identity Emporium. The sheet shows the storefront exterior, main sales floor, costume and prop wall, fitting room corridor, counter/checkout area, and a details/close-ups panel. The palette is warm green, wood, brass, and cream.",
  "observed_visual_facts": {
    "composition": [
      "Header 'Identity Emporium - Environment Asset Class Overview'.",
      "Top-left: main sales floor isometric view.",
      "Top-right: storefront exterior.",
      "Bottom row: costume & prop wall, fitting room corridor, counter/checkout area, details & shop close-ups.",
      "Footer with approved style notes."
    ],
    "palette": [
      "Warm green painted wood.",
      "Aged timber and brass.",
      "Cream paper and off-white tags.",
      "Amber and warm incandescent light."
    ],
    "notable_features": [
      "Green and cream striped awning on the exterior.",
      "Clothing racks, folded costumes, and props inside.",
      "Wooden counter with brass lamp and tags.",
      "Fitting room corridor with red curtains."
    ]
  },
  "positive_constraints": [
    "Use this as the canonical Identity Emporium environment overview.",
    "Preserve the warm green-wood-brass palette and shop elements.",
    "Keep the six-view overview structure."
  ],
  "negative_constraints": [
    "Do not add extra locations or views beyond the six shown.",
    "Do not change the shop identity to a generic store.",
    "Do not remove the shopkeeper or canonical props without review."
  ],
  "sidecar_usage": {
    "best_for": [
      "Identity Emporium environment planning.",
      "QA of generated Identity Emporium scenes.",
      "Prompt extraction for the costume-and-prop shop."
    ],
    "not_sufficient_for": [
      "Exact prop labels; inspect pixels.",
      "Final canon without image QA.",
      "Per-room detailed sheets."
    ],
    "linear_view_route": null
  }
}
