{
  "schema": "adventures.visual_sidecar.adjacent.v1",
  "project": "Adventures of Patch",
  "character": "Rollback",
  "sidecar_purpose": "Repo-resident semantic image sidecar for Codex/Devin worker selection, visual continuity, QA, and prompt constraint extraction.",
  "source_truth_note": "This sidecar describes a promoted Heist Crew character reference. The repo image bytes and package manifest remain authoritative for custody; the acceptance state controls its continuity role.",
  "runtime_use_note": "Use this sidecar for ordinary textual selection and continuity work. Inspect the image pixels directly when exact composition, small text, proportions, or fine visual details matter.",
  "do_not_infer_note": "Do not infer unseen alternate views, additional props, story state, or acceptance of derivative images beyond what is described here.",
  "image": {
    "repo_image_path": "build/characters/heist-crew/reference_sheets/rollback_hero__v1.png",
    "relative_image_path": "rollback_hero__v1.png",
    "repo_sidecar_path": "build/characters/heist-crew/reference_sheets/rollback_hero__v1-sidecar.json",
    "relative_sidecar_path": "rollback_hero__v1-sidecar.json",
    "image_filename": "rollback_hero__v1.png",
    "sha256": "e589526afc89f38ced0d49bd46b4ebcbbb23b310a11cd79654042d1a544286f1",
    "byte_size": 2081182,
    "mime_type": "image/png",
    "dimensions": {
      "width": 1122,
      "height": 1402
    },
    "mode": "RGB",
    "asset_role": "approved-hero",
    "acceptance_state": "approved",
    "inspection_mode": "pixel_inspection",
    "confidence": "high",
    "provenance": {
      "generator": "unknown",
      "model": "unknown",
      "generated_at": null,
      "prompt_language": null,
      "prompt": null,
      "prompt_retained": false,
      "prompt_unretained_note": "Provenance has not been determined for this image."
    }
  },
  "summary": "Approved hero image of Rollback, the Rollback is the recovery, contingency, containment, abort-condition, restore-path, and Plan B specialist. He proves that a plan without recovery is not a plan.. It is the clearest single-image reference for Rollback's demeanor, silhouette, costume, and role.",
  "observed_visual_facts": {
    "composition": [
      "Portrait-oriented hero image of Rollback, the contingency."
    ],
    "character_design": [
      "Patch-level autonomous-agent body, larger than Patch but still within believable agent scale;",
      "broad, stocky, physically imposing build with a low, grounded centre of gravity;",
      "strong Black bearded-man read through integrated faceplate colour, close-cropped beard shape, head silhouette, stance, warmth, and wry calm;",
      "smooth warm rich-brown visor / faceplate, darker than Patch and Silk's pale plates, still clearly a non-skin agent faceplate;",
      "calm narrow dark eye slits set into the faceplate;",
      "neat close-cropped afro beard / short boxed beard / disciplined jawline beard, compact and deliberate, not a giant full beard;",
      "exactly one antenna as a shared specialist-agent marker and Patch distinction;",
      "one loose outerwear hood pulled up over the head; avoid nested or double hood reads;"
    ],
    "mood_and_role": [
      "Rollback is the recovery, contingency, containment, abort-condition, restore-path, and Plan B specialist. He proves that a plan without recovery is not a plan."
    ],
    "style": [
      "Clean Adventures editorial/vector-adjacent finish with controlled painterly shading."
    ]
  },
  "positive_constraints": [
    "Rollback is a Patch-level autonomous-agent contingency and recovery specialist. He is the largest believable agent in the room: taller and broader than Patch, almost improbably large for an agent, but still not human-scale. He reads as a broad, burly Black bearded man through integrated warm rich-brown agent faceplate, neat close-cropped black afro-beard / short boxed beard, head shape, stance, warmth, and wry calm. He has calm narrow dark eye slits, exactly one antenna, one loose outer hood pulled up over his head, olive-drab hooded workwear or heavy soft-shell containment-operator outerwear, darker underlayers, muted hardware, compact containment / rollback / restore tools, Rollback-specific tag language such as PLAN B / RESTORE / FAILSAFE / ROLLBACK, and a grounded planted posture. Use a clean character-reference read with controlled light painterly material richness; do not push him into full dark bunker style. His domain is an active contingency bunker with observation-deck windows, controlled simulations, Plan B / Plan C labels, recovery logic, and failure-on-failure rooms, but hero-reference images should keep him primary and use only light domain cues. He asks “What’s your Plan B?” and, when Patch has none, says “Then you ain’t got no plan.” He realizes this is exactly why Patch needs him, says “You son of a gun,” and joins."
  ],
  "negative_constraints": [
    "Do not make Rollback a literal human soldier, human security guard, realistic human Black man in field gear, gun-happy commando, weapons dealer, villain, bodyguard stereotype, thug, wrestler, angry brute, animal, Patch clone, Bit/Bot-style robot, generic robot tank, blocky humanoid robot, generic strongman, or Black man pasted onto a robot body. Do not make him human-sized, long-legged, tactical-mannequin, gung-ho, combat-ready, military fantasy, camouflage-clad, armored, armed, or security-coded. Do not show guns, knives, ammo, weapons racks, tactical violence, war scenes, flags, real military insignia, aggressive combat posing, police/security uniform language, or soldier kit. Do not give him Patch's teal hoodie, two antennae, crossbody terminal bag, `>` symbol, pale Patch/Silk-style faceplate, or protagonist colour read. Do not use a hard rectangular robot mask, exposed realistic human skin face, nested/double hoods, giant full beard, full camouflage pattern, Silk's LINE 07 tag language, threadline identity cues, or dark bunker scenery that overwhelms the character. Do not make the bunker a static storeroom, war room, armoury, command bridge, generic warehouse, or combat bunker instead of an active contingency environment. Do not use the anti-pattern sheet as positive reference."
  ],
  "sidecar_usage": {
    "best_for": [
      "Single-image Rollback hero reference.",
      "Face, outfit, and prop continuity.",
      "Prompting Rollback hero scenes.",
      "QA for demeanor and ontology."
    ],
    "not_sufficient_for": [
      "Full turnaround; use the Rollback-approved style sheet.",
      "Complete prop inventory; use the Rollback-approved style sheet.",
      "Anti-pattern checks; use the anti-pattern sheet."
    ],
    "linear_view_route": null
  },
  "created_at": "2026-08-20T18:23:13.641039Z"
}
